類型,基因名稱,主/被動,技能名稱,所需等級,消耗羈絆值,技能詳情,可持有隨行獸,隨行獸備註
無,靈魂羈絆基因【小】,被動,靈魂羈絆【小】,1,-,羈絆值上升極少量提升【強化0】,草食龍、雌火龍、眠狗龍王,
無,靈魂羈絆基因【中】,被動,靈魂羈絆【中】,1,-,羈絆值上升略微提升【強化0】,草食龍、雌火龍、眠狗龍王、滅盡龍、恐暴龍、獄狼龍、麒麟、炎王龍、鋼龍、冰呪龍,
無,靈魂羈絆基因【大】,被動,靈魂羈絆【大】,1,-,羈絆值上升顯著提升【強化0】,滅盡龍、恐暴龍、獄狼龍、麒麟、炎王龍、鋼龍、冰呪龍,
無,靈魂羈絆基因【特大】,被動,靈魂羈絆【特】,1,-,羈絆值上升特顯著提升【強化0】,草食龍、雌火龍、眠狗龍王、滅盡龍、恐暴龍、獄狼龍、麒麟、炎王龍、鋼龍、冰呪龍,皆為上位怪
無,自我回復基因【小】,被動,自我回復【小】,1,-,回合結束時體力獲得小回復【強化0】,砂龍王、泡狐龍、紫水獸,
無,自我回復基因【中】,被動,自我回復【中】,1,-,回合結束時體力獲得中回復【強化0】,砂龍王、泡狐龍、紫水獸、滅盡龍、麒麟、炎王龍、鋼龍、冰呪龍,
無,自我回復基因【大】,被動,自我回復【大】,1,-,回合結束時體力獲得大回復【強化0】,滅盡龍、麒麟、炎王龍、鋼龍、冰呪龍,
無,自我回復基因【特大】,被動,自我回復【特】,1,-,回合結束時體力獲得特大回復【強化0】,滅盡龍、麒麟、炎王龍、鋼龍、冰呪龍,皆為上位怪
速度,爪刺基因【大】,主動,螺旋爪,1,19,對單一敵方造成無屬性大量傷害,天眼泡狐龍,
速度,破壞基因【大】,主動,碎身角,15,22,對單一敵方造成無屬性大量傷害。中機率使其防禦力降低3回合,冰麒麟,
